{
  "schema_version": 1,
  "status": "baseline_complete",
  "activation_scope": "canonical_source_blueprint_closure",
  "protocol_version": "1.4.0",
  "requirement_range": {
    "first": 1,
    "last": 96,
    "count": 96
  },
  "requirements": [
    {
      "requirement_id": "REQ-01",
      "domain": "core_project_lifecycle",
      "authoritative_docs": [
        "START-HERE.md",
        "PROJECT-INITIALIZATION.md",
        "PROJECT-MANAGEMENT.md",
        "DEVELOPMENT-LIFECYCLE.md",
        "AI-NATIVE-EXECUTION.md",
        "MULTI-AGENT-ORCHESTRATION.md",
        "AUTO-AGENT.md",
        "SUPERVISOR.md",
        "ORCHESTRATOR.md",
        "CODE-QUALITY.md"
      ],
      "machine_controls": [
        "config/protocol/version.json",
        "config/protocol/state-machine.json",
        "config/traceability/requirements-traceability.json",
        "config/coordination/agent-work-queue.json",
        "config/coordination/supervisor-state.json"
      ],
      "verification_refs": [
        "scripts/validate_ai_native_repo.py",
        "tests/test_control_plane.py",
        "config/testing/conformance-scenarios.json"
      ],
      "coverage_status": "covered_by_blueprint",
      "runtime_evidence_required_in_child": true
    },
    {
      "requirement_id": "REQ-02",
      "domain": "core_project_lifecycle",
      "authoritative_docs": [
        "START-HERE.md",
        "PROJECT-INITIALIZATION.md",
        "PROJECT-MANAGEMENT.md",
        "DEVELOPMENT-LIFECYCLE.md",
        "AI-NATIVE-EXECUTION.md",
        "MULTI-AGENT-ORCHESTRATION.md",
        "AUTO-AGENT.md",
        "SUPERVISOR.md",
        "ORCHESTRATOR.md",
        "CODE-QUALITY.md"
      ],
      "machine_controls": [
        "config/protocol/version.json",
        "config/protocol/state-machine.json",
        "config/traceability/requirements-traceability.json",
        "config/coordination/agent-work-queue.json",
        "config/coordination/supervisor-state.json"
      ],
      "verification_refs": [
        "scripts/validate_ai_native_repo.py",
        "tests/test_control_plane.py",
        "config/testing/conformance-scenarios.json"
      ],
      "coverage_status": "covered_by_blueprint",
      "runtime_evidence_required_in_child": true
    },
    {
      "requirement_id": "REQ-03",
      "domain": "core_project_lifecycle",
      "authoritative_docs": [
        "START-HERE.md",
        "PROJECT-INITIALIZATION.md",
        "PROJECT-MANAGEMENT.md",
        "DEVELOPMENT-LIFECYCLE.md",
        "AI-NATIVE-EXECUTION.md",
        "MULTI-AGENT-ORCHESTRATION.md",
        "AUTO-AGENT.md",
        "SUPERVISOR.md",
        "ORCHESTRATOR.md",
        "CODE-QUALITY.md"
      ],
      "machine_controls": [
        "config/protocol/version.json",
        "config/protocol/state-machine.json",
        "config/traceability/requirements-traceability.json",
        "config/coordination/agent-work-queue.json",
        "config/coordination/supervisor-state.json"
      ],
      "verification_refs": [
        "scripts/validate_ai_native_repo.py",
        "tests/test_control_plane.py",
        "config/testing/conformance-scenarios.json"
      ],
      "coverage_status": "covered_by_blueprint",
      "runtime_evidence_required_in_child": true
    },
    {
      "requirement_id": "REQ-04",
      "domain": "core_project_lifecycle",
      "authoritative_docs": [
        "START-HERE.md",
        "PROJECT-INITIALIZATION.md",
        "PROJECT-MANAGEMENT.md",
        "DEVELOPMENT-LIFECYCLE.md",
        "AI-NATIVE-EXECUTION.md",
        "MULTI-AGENT-ORCHESTRATION.md",
        "AUTO-AGENT.md",
        "SUPERVISOR.md",
        "ORCHESTRATOR.md",
        "CODE-QUALITY.md"
      ],
      "machine_controls": [
        "config/protocol/version.json",
        "config/protocol/state-machine.json",
        "config/traceability/requirements-traceability.json",
        "config/coordination/agent-work-queue.json",
        "config/coordination/supervisor-state.json"
      ],
      "verification_refs": [
        "scripts/validate_ai_native_repo.py",
        "tests/test_control_plane.py",
        "config/testing/conformance-scenarios.json"
      ],
      "coverage_status": "covered_by_blueprint",
      "runtime_evidence_required_in_child": true
    },
    {
      "requirement_id": "REQ-05",
      "domain": "core_project_lifecycle",
      "authoritative_docs": [
        "START-HERE.md",
        "PROJECT-INITIALIZATION.md",
        "PROJECT-MANAGEMENT.md",
        "DEVELOPMENT-LIFECYCLE.md",
        "AI-NATIVE-EXECUTION.md",
        "MULTI-AGENT-ORCHESTRATION.md",
        "AUTO-AGENT.md",
        "SUPERVISOR.md",
        "ORCHESTRATOR.md",
        "CODE-QUALITY.md"
      ],
      "machine_controls": [
        "config/protocol/version.json",
        "config/protocol/state-machine.json",
        "config/traceability/requirements-traceability.json",
        "config/coordination/agent-work-queue.json",
        "config/coordination/supervisor-state.json"
      ],
      "verification_refs": [
        "scripts/validate_ai_native_repo.py",
        "tests/test_control_plane.py",
        "config/testing/conformance-scenarios.json"
      ],
      "coverage_status": "covered_by_blueprint",
      "runtime_evidence_required_in_child": true
    },
    {
      "requirement_id": "REQ-06",
      "domain": "core_project_lifecycle",
      "authoritative_docs": [
        "START-HERE.md",
        "PROJECT-INITIALIZATION.md",
        "PROJECT-MANAGEMENT.md",
        "DEVELOPMENT-LIFECYCLE.md",
        "AI-NATIVE-EXECUTION.md",
        "MULTI-AGENT-ORCHESTRATION.md",
        "AUTO-AGENT.md",
        "SUPERVISOR.md",
        "ORCHESTRATOR.md",
        "CODE-QUALITY.md"
      ],
      "machine_controls": [
        "config/protocol/version.json",
        "config/protocol/state-machine.json",
        "config/traceability/requirements-traceability.json",
        "config/coordination/agent-work-queue.json",
        "config/coordination/supervisor-state.json"
      ],
      "verification_refs": [
        "scripts/validate_ai_native_repo.py",
        "tests/test_control_plane.py",
        "config/testing/conformance-scenarios.json"
      ],
      "coverage_status": "covered_by_blueprint",
      "runtime_evidence_required_in_child": true
    },
    {
      "requirement_id": "REQ-07",
      "domain": "core_project_lifecycle",
      "authoritative_docs": [
        "START-HERE.md",
        "PROJECT-INITIALIZATION.md",
        "PROJECT-MANAGEMENT.md",
        "DEVELOPMENT-LIFECYCLE.md",
        "AI-NATIVE-EXECUTION.md",
        "MULTI-AGENT-ORCHESTRATION.md",
        "AUTO-AGENT.md",
        "SUPERVISOR.md",
        "ORCHESTRATOR.md",
        "CODE-QUALITY.md"
      ],
      "machine_controls": [
        "config/protocol/version.json",
        "config/protocol/state-machine.json",
        "config/traceability/requirements-traceability.json",
        "config/coordination/agent-work-queue.json",
        "config/coordination/supervisor-state.json"
      ],
      "verification_refs": [
        "scripts/validate_ai_native_repo.py",
        "tests/test_control_plane.py",
        "config/testing/conformance-scenarios.json"
      ],
      "coverage_status": "covered_by_blueprint",
      "runtime_evidence_required_in_child": true
    },
    {
      "requirement_id": "REQ-08",
      "domain": "core_project_lifecycle",
      "authoritative_docs": [
        "START-HERE.md",
        "PROJECT-INITIALIZATION.md",
        "PROJECT-MANAGEMENT.md",
        "DEVELOPMENT-LIFECYCLE.md",
        "AI-NATIVE-EXECUTION.md",
        "MULTI-AGENT-ORCHESTRATION.md",
        "AUTO-AGENT.md",
        "SUPERVISOR.md",
        "ORCHESTRATOR.md",
        "CODE-QUALITY.md"
      ],
      "machine_controls": [
        "config/protocol/version.json",
        "config/protocol/state-machine.json",
        "config/traceability/requirements-traceability.json",
        "config/coordination/agent-work-queue.json",
        "config/coordination/supervisor-state.json"
      ],
      "verification_refs": [
        "scripts/validate_ai_native_repo.py",
        "tests/test_control_plane.py",
        "config/testing/conformance-scenarios.json"
      ],
      "coverage_status": "covered_by_blueprint",
      "runtime_evidence_required_in_child": true
    },
    {
      "requirement_id": "REQ-09",
      "domain": "core_project_lifecycle",
      "authoritative_docs": [
        "START-HERE.md",
        "PROJECT-INITIALIZATION.md",
        "PROJECT-MANAGEMENT.md",
        "DEVELOPMENT-LIFECYCLE.md",
        "AI-NATIVE-EXECUTION.md",
        "MULTI-AGENT-ORCHESTRATION.md",
        "AUTO-AGENT.md",
        "SUPERVISOR.md",
        "ORCHESTRATOR.md",
        "CODE-QUALITY.md"
      ],
      "machine_controls": [
        "config/protocol/version.json",
        "config/protocol/state-machine.json",
        "config/traceability/requirements-traceability.json",
        "config/coordination/agent-work-queue.json",
        "config/coordination/supervisor-state.json"
      ],
      "verification_refs": [
        "scripts/validate_ai_native_repo.py",
        "tests/test_control_plane.py",
        "config/testing/conformance-scenarios.json"
      ],
      "coverage_status": "covered_by_blueprint",
      "runtime_evidence_required_in_child": true
    },
    {
      "requirement_id": "REQ-10",
      "domain": "core_project_lifecycle",
      "authoritative_docs": [
        "START-HERE.md",
        "PROJECT-INITIALIZATION.md",
        "PROJECT-MANAGEMENT.md",
        "DEVELOPMENT-LIFECYCLE.md",
        "AI-NATIVE-EXECUTION.md",
        "MULTI-AGENT-ORCHESTRATION.md",
        "AUTO-AGENT.md",
        "SUPERVISOR.md",
        "ORCHESTRATOR.md",
        "CODE-QUALITY.md"
      ],
      "machine_controls": [
        "config/protocol/version.json",
        "config/protocol/state-machine.json",
        "config/traceability/requirements-traceability.json",
        "config/coordination/agent-work-queue.json",
        "config/coordination/supervisor-state.json"
      ],
      "verification_refs": [